{
  "schema_version": "h2-audit-run-v2",
  "run_phase": "calibration_prepared",
  "audit_id": "h2_audit_demo_v1",
  "audit_frame_version": "h2_calibration_frame_demo_v1",
  "candidate_frame_id": "h2_candidates_demo_v1",
  "h2_scheme_version": "T_v1-2026-pre1",
  "calibration_labeling_guide_version": "h2_guide_demo_calibration_v1",
  "audit_labeling_guide_version": null,
  "grnti_scheme_version": "GRNTI-2025",
  "query_version": "h2_queries_demo_v1",
  "preprocessing_version": "h2_preprocessing_demo_v1",
  "input_serialization": "utf8-nfc-title-lf2-abstract-lf-v1",
  "selection_seed": 20260827,
  "calibration_size": 30,
  "audit_size": 200,
  "annotator_ids": ["annotator_01", "annotator_02"],
  "adjudicator_id": "adjudicator_01",
  "code_commit": "0000000-demo",
  "grnti_reference_path": "data/raw/references/grnti_2025_source.pdf",
  "grnti_reference_url": "https://www.gpntb.ru/images/GRNTI/grnti2025.pdf",
  "grnti_reference_retrieved_at": "2026-08-27T14:57:43+03:00",
  "grnti_reference_sha256": "bb67e730a665299de60be5fcde9aa1acb9dff30842dd29f9818e4c709b932d58",
  "grnti_reference_bytes": 2358762,
  "grnti_excerpt_path": "manifests/frozen/grnti_excerpt.json",
  "grnti_excerpt_sha256": "2222222222222222222222222222222222222222222222222222222222222222",
  "calibration_labeling_guide_path": "manifests/frozen/calibration_guide.md",
  "calibration_labeling_guide_sha256": "7777777777777777777777777777777777777777777777777777777777777777",
  "audit_labeling_guide_path": null,
  "audit_labeling_guide_sha256": null,
  "decision_tree_path": "manifests/frozen/decision_tree.yaml",
  "decision_tree_sha256": "4444444444444444444444444444444444444444444444444444444444444444",
  "calibration_plan_path": "manifests/h2_calibration_plan.json",
  "calibration_plan_sha256": "9999999999999999999999999999999999999999999999999999999999999999",
  "query_manifest_path": "manifests/h2_queries.jsonl",
  "query_manifest_sha256": "5555555555555555555555555555555555555555555555555555555555555555",
  "preprocessing_rules_path": "manifests/frozen/preprocessing_rules.json",
  "preprocessing_rules_sha256": "6666666666666666666666666666666666666666666666666666666666666666",
  "source_candidate_manifest_path": "manifests/works.jsonl",
  "source_candidate_manifest_sha256": "bbbbbbbbbbbbbbbbbbbbbbbbbbbbbbbbbbbbbbbbbbbbbbbbbbbbbbbbbbbbbbbb",
  "previous_run_path": null,
  "previous_run_sha256": null,
  "calibration_inputs_checksum_path": "manifests/calibration_inputs.sha256",
  "calibration_inputs_checksum_sha256": "cccccccccccccccccccccccccccccccccccccccccccccccccccccccccccccccc",
  "calibration_result_path": null,
  "calibration_result_sha256": null,
  "audit_inputs_checksum_path": null,
  "audit_inputs_checksum_sha256": null,
  "created_at": "2026-08-27T16:00:00+03:00"
}
